{
	"$schema": "../feature.schema.json",
	"id": "openapi",
	"name": "OpenAPI Documentation",
	"description": "Add OpenAPI/Swagger documentation with interactive UI at /docs",
	"dependencies": {
		"@dwex/openapi": "^<%= version %>"
	},
	"mainAdditions": {
		"imports": [
			"import { setupOpenApi } from \"./openapi.setup\";"
		],
		"beforeListen": [
			"\t// Setup OpenAPI documentation",
			"\tsetupOpenApi(app);"
		]
	}
}
